file_name,uni,wylie,url,dept,grade,char_len,audio_len,path,inf
STT_MV0400_0014_95223_to_99257,ད་ངས་བྱས་ན་ང་རང་ཚོའི་ནང་ལ་རྦའོ་མོས་ཤིག་བཙལ་ན། གཞན་མ་གཏོགས་གཅིག་གིས།  ,da ngas byas na nga rang tsho'i nang la rba'o mos shig btsal na/_gzhan ma gtogs gcig gis/__,https://d38pmlk0v88drf.cloudfront.net/wav16k/STT_MV0400_0014_95223_to_99257.wav,STT_MV,2,69,4.034,wav16k/STT_MV0400_0014_95223_to_99257.wav,ད་ངས་བྱས་ན་ ང་རང་ཚོའི་ནང་ལ་སྤོ་མོ་གཅིག་བཙལ་ན། གཞན་མ་གཏོགས་གཅིག་གིས།
STT_MV0400_0005_34962_to_42795,འདི་གཙང་མ་མེད་པའི་བཟོ་འདྲ་འདུག་ག་དེ། གཙང་མ་ཞེ་བོ་མེད་འགྲོ། ད་སུར་པན་ཞེ་བོ་དེ་འདྲས་མ་ཟ་ཨ་མས། སྒེར་གི་རེད་བ། ནང་རེད་འདུག་ག ཡོ། ད་པཱ་ལགས་རང་ཚགས་པར་གཡུག་ཤོག་ད། ལྟོ་བཞེས་ད། འོ།  ,'di gtsang ma med pa'i bzo 'dra 'dug ga de/_gtsang ma zhe bo med 'gro/_da sur pan zhe bo de 'dras ma za a mas/_sger gi red ba/_nang red 'dug ga_yo/_da pA lags rang tshags par g.yug shog da/_lto bzhes da/_'o/__,https://d38pmlk0v88drf.cloudfront.net/wav16k/STT_MV0400_0005_34962_to_42795.wav,STT_MV,2,173,7.833,wav16k/STT_MV0400_0005_34962_to_42795.wav,དགཙང་མ་མེད་འགྲོ་བསམ་འདུག་འདི། ཡ གྐང་མ་ཞེ་བོ་མེད་འགྲོ་བསམ་གི། ད་སི་མན་ཞེ་་སྒེར་ར་ཟེ་ཨ་གོ་ཨ་མ། ནང་ལ་འདུག་ག ཡ། ལོ། ད་པ་ལགས་རང་ྟགས་པར་གཡུག་ཤོག་ད། ལྟོག་གྱིས་ད། འ
STT_HS0007_0389_2529428_to_2533831,བོད་ཀི་སྐད་ཆ་བཤད་བསྡད་བསྡད་དུས། དེ་ང་རའི་སྟོད་ན་དེ་གཅིག་བྱེད་ཀིས་ ,bod ki skad cha bshad bsdad bsdad dus/_de nga ra'i stod na de gcig byed kis _,https://d38pmlk0v88drf.cloudfront.net/wav16k/STT_HS0007_0389_2529428_to_2533831.wav,STT_HS,2,66,4.403,wav16k/STT_HS0007_0389_2529428_to_2533831.wav,ད་བོད་ཀི་སྐད་ཆ་བཤད་བསྡད་འདུག དེ་་ང་རང་སྟོད་ལ་དེ་དྲ་ཅིག་བྱེད་ཀི།
STT_MV0400_0016_108134_to_118013,ད་དེང་སང་རྦའོ་མོས་དཀོན་པོ་ཞེ་བོ་འདུག་ཟེར་གི་འདུག འོ་སྣང་དག་མེད། ངས་ཇོ་ཟླ་བ་ལགས་མངགས་བཞག་ཡོད། མངག་ཚར་བེ། འོ། ཇོ་ཟླ་བ་ཁོང་གྲོང་གསེབ་ལ་སྤུན་རྒྱ་མང་པོ་རེད་བ། གཅིག་ལྟོས་ཤོག་ལབ་ཤག་ཡོད། འོ།  ,da deng sang rba'o mos dkon po zhe bo 'dug zer gi 'dug_'o snang dag med/_ngas jo zla ba lags mngags bzhag yod/_mngag tshar be/_'o/_jo zla ba khong grong gseb la spun rgya mang po red ba/_gcig ltos shog lab shag yod/_'o/__,https://d38pmlk0v88drf.cloudfront.net/wav16k/STT_MV0400_0016_108134_to_118013.wav,STT_MV,2,184,9.879,wav16k/STT_MV0400_0016_108134_to_118013.wav,ད་དེང་སང་དཔའ་མོག་དཀོན་པོ་ཞེ་བོ་ཞིག་འདུག་ཟེར་གི་འདུག་ག འོ་སྣང་དག་མེད། ཡ་ཇོ་ཟླ་ོ་ལགས་སྔགས་བཞག་ཡོད། བརླགས་ཚར་པེ། འོ།ཇོ་ཟླའ་ལགས་ཁོང་ཚོ་གྲོང་གསེབ་ལ་སྤུན་རྒྱ་མང་པོ་རེད་པ། ཕཅིག་ལྟོས་ཤོག་ཨ་ལབ་ཡོད།
STT_MV0400_0026_181854_to_183887,ཨ་ཙི་བུ་མོ། འདིར་མ་སྡོད་འདིར་མ་སྡོད།  ,a tsi bu mo/_'dir ma sdod 'dir ma sdod/__,https://d38pmlk0v88drf.cloudfront.net/wav16k/STT_MV0400_0026_181854_to_183887.wav,STT_MV,2,38,2.033,wav16k/STT_MV0400_0026_181854_to_183887.wav,ཨོ་ཙི་ བུ་མོ། འདིར་མ་སྡོད། འདིར་མ་སྡོད།
STT_MV0400_0028_192716_to_198795,ཧཧཧ། ཨ་ཙི། གྲོང་གསེབ་ནས་ཡོང་བ་ཟེར་ཡ་དེ་ངོ་ཚ་སྨིན་པོ་ཡོད་རེད་།  ,hahaha/_a tsi/_grong gseb nas yong ba zer ya de ngo tsha smin po yod red /__,https://d38pmlk0v88drf.cloudfront.net/wav16k/STT_MV0400_0028_192716_to_198795.wav,STT_MV,2,63,6.079,wav16k/STT_MV0400_0028_192716_to_198795.wav,ཧ་ཧ་ཧ་ཧ། ཨོ་ཙི། ཨམ་ལགས།ཧ། གྲོང་གསེབ་ནས་ཡོང་པ་ཟེར་ག་བྱས་ངོ་ཚ་སྨོན་པོ་ཡོད་རེད།
STT_MV0400_0030_206797_to_214474,ཨ་ལས་ཇ་དེ་བཏུངས་ད། ལགས། ཇ་བཏུངས་ཇ་བཏུངས། ད་རང་སྔ་བོ་ཞེ་བོ་གཅིག་ཡོང་པེ། ཡོད་པ་ཡིན་ལགས།  ,a las ja de btungs da/_lags/_ja btungs ja btungs/_da rang snga bo zhe bo gcig yong pe/_yod pa yin lags/__,https://d38pmlk0v88drf.cloudfront.net/wav16k/STT_MV0400_0030_206797_to_214474.wav,STT_MV,2,87,7.677,wav16k/STT_MV0400_0030_206797_to_214474.wav,ཨ་ལས་ཇ་དེ་བཏུང་ད། ཇ་ལག། ཇ་བཏུང་ཇ་བཐུང་། ད་རང་སྔ་པོ་ཞེ་བོ་གཅིག་ཡོང་པེ། ཡོང་པི་ཡིན་ལས།
STT_MV0400_0031_214474_to_219108,ཡ་མར་བསྡད་བྱས་བཏུངས་ད། མར་སྡོད་མར་སྡོད། ལ། ཐུགས་ཆེ་གནང་།  ,ya mar bsdad byas btungs da/_mar sdod mar sdod/_la/_thugs che gnang /__,https://d38pmlk0v88drf.cloudfront.net/wav16k/STT_MV0400_0031_214474_to_219108.wav,STT_MV,2,58,4.634,wav16k/STT_MV0400_0031_214474_to_219108.wav,ཡ་མར་བསྡད་བྱས་བཏུང་ད། མར་སྡོད་ མར་སྡོད། ་རེ་ད། འ་། ཐུགས་ཆེ་གནང་།
STT_MV0400_0033_220970_to_226289,ཨ་མ་ལགས་མགྱོགས་པོ་ཁ་ལག་ཟོས། བུ་མོ་ལྟོགས་ཀི་ཡོད་རེད། ཡོ་ཡོ། ཨ་ཙི། བདག་ལྟོགས་ཀི་མི་འདུག་ལ། གེ་བྱེད་ཀི་མ་རེད། བདག་ལྟོགས་ཀི་མི་འདུག་ལ།  ,a ma lags mgyogs po kha lag zos/_bu mo ltogs ki yod red/_yo yo/_a tsi/_bdag ltogs ki mi 'dug la/_ge byed ki ma red/_bdag ltogs ki mi 'dug la/__,https://d38pmlk0v88drf.cloudfront.net/wav16k/STT_MV0400_0033_220970_to_226289.wav,STT_MV,2,132,5.319,wav16k/STT_MV0400_0033_220970_to_226289.wav,ཨ་མ་ལགས། མགྱོགས་ཁ་ལག་བཟོས་ས། བུ་མོ་ལྟོགས་ཀི་ཡོད་རེད། ཡོད་་ཡོད། ཨ་ཙི། དག་ལྟོགས་ཀི་མི་འདུག་ལགསྱེད་ི་མ་རེད།། དག་ྟོགས་ཀི་མི་འདུག་ལག།
STT_MV0400_0034_226289_to_233418,བདག་ད་གིན་ལམ་འགག་ནས་རྒྱགས་ཚད་བཟས་པ་ཡིན་ལ། ཨ་ལེ། རེད་པ། འོང་འོང། སྡོད་སྡོད། སྡོད་ཤིག ,bdag da gin lam 'gag nas rgyags tshad bzas pa yin la/_a le/_red pa/_'ong 'ong/_sdod sdod/_sdod shig_,https://d38pmlk0v88drf.cloudfront.net/wav16k/STT_MV0400_0034_226289_to_233418.wav,STT_MV,2,84,7.129,wav16k/STT_MV0400_0034_226289_to_233418.wav,བདག་ད་གིན་ལམ་ག་ནས་རྒྱག་ཚད་བཟས་པ་ཡིན།  རེད་པེ། འོ འོ། ། སྡོད་སྡད་སྡོད་ད།། ར་ཐེད་ཤོག
STT_MV0399_0136_819053_to_826873,ལྷན་རྒྱས་ཚོ་སྤྲོ་པོ་ཡོང་བའི་སྨོན་འདུན་ཞུ་གི་ཡིན། ད་ལྷ་སྐྱིད་ལགས་ང་གཉིས་འགྲོ འགྲོ་སྤོ་ལགས། འདི་ནས་མར་ཕྱིན།  ,lhan rgyas tsho spro po yong ba'i smon 'dun zhu gi yin/_da lha skyid lags nga gnyis 'gro_'gro spo lags/_'di nas mar phyin/__,https://d38pmlk0v88drf.cloudfront.net/wav16k/STT_MV0399_0136_819053_to_826873.wav,STT_MV,2,107,7.82,wav16k/STT_MV0399_0136_819053_to_826873.wav,ལྷན་རྒྱས་ཚོ་སྤྲོ་པོ་ཡོང་བའི་སྨོན་འདུན་ཞུ་གི་ཡིན། ད་ལྷ་སྐྱིད་ལགས་ངེད་གཉིས་འགྲོ འགྲོ་སྤོ་ལགས། འདི་ནས་མར་ཕྱིན།
STT_MV0400_0015_99257_to_108134,ཨ་མ་དཀའ་ལས་ཡག་སེ་ཁག་གི་འདུག་ག རེད་རེད། ང་རང་ཚོས་གླ་སྤྲད་མི་ཐུབ་པ་ནི་མ་རེད། འོ། ང་ནི་ཨ་མ་སྙིང་ར་ཞིག་རྗེ་གིས། བྱས་ཙང་། འོ་ད་ངས་བྱེད་དགོས། ཨ་མ་རང་སྡོད་ཤིག སྡོད་ད་སྡོད། རྦའོ་མོས་བསམ་གིས་ཏེ་ལས།  ,a ma dka' las yag se khag gi 'dug ga_red red/_nga rang tshos gla sprad mi thub pa ni ma red/_'o/_nga ni a ma snying ra zhig rje gis/_byas tsang /_'o da ngas byed dgos/_a ma rang sdod shig_sdod da sdod/_rba'o mos bsam gis te las/__,https://d38pmlk0v88drf.cloudfront.net/wav16k/STT_MV0400_0015_99257_to_108134.wav,STT_MV,2,190,8.877,wav16k/STT_MV0400_0015_99257_to_108134.wav,ཨ་མ་དཀའ་ལས་ཡག་སེ་ཁག་གི་འདུག་ག རེད་རེད། ང་རང་ཚོས་གླ་སྤྲད་མ་ཐུབ་ན་མ་རེད། འ ཨེ་ནས་ཨ་མར་སྙིང་ར་ཞིག་རྱེད་ཀི། བྱས་ཙང་ དེ་ད་ངས་བ ཨ་མ་རང་སྡོད་ཤོག  སྡོད་ད་ སྡོད་ད། ོ་ཡ་དེ་ལགས་མེད་ད།
STT_MV0400_0035_233418_to_240714,འོང་འོང་པ་ཟླ་བ། ཨ་ཙི། འོ་སྦེ། འདི་བདག་ཚོའི་ལུང་པའི་རྔན་པ་སྦེ། མཆོད་ད་ལགས། མཆོད་ད་ལགས།  ,'ong 'ong pa zla ba/_a tsi/_'o sbe/_'di bdag tsho'i lung pa'i rngan pa sbe/_mchod da lags/_mchod da lags/__,https://d38pmlk0v88drf.cloudfront.net/wav16k/STT_MV0400_0035_233418_to_240714.wav,STT_MV,2,87,7.296,wav16k/STT_MV0400_0035_233418_to_240714.wav,འོའ་འོ། ཨོ་ཙི། ོ་ད།འོ་སྦེ།  འདི་བདག་ཙི་ལུང་པའི་རྔ་པ་སྦེ། མཆོད་ད་ལ། ལགས། མཆོད་ད་ལག།
STT_MV0400_0027_183887_to_192716,ཡར་ལོངས་། བདག་ནི་རུ་བསྡད་ན་འགྲིག་པ། འདིར་བསྡད་མྱི་ཡོད་མ་རེད་བྱས། ཧཧཧ། བུ་མོ་རང་ནི། འདིར་བསྡད་མྱི་ག་བར་ཡོད་རེད། སྒང་འདིར་སྡོད་ཤོག ཨ་ཙི་འདིར་ཤོག་འདིར་ཤོག ལགས། ཨེ་ནས་འདིར་སྡོད།  ,yar longs /_bdag ni ru bsdad na 'grig pa/_'dir bsdad myi yod ma red byas/_hahaha/_bu mo rang ni/_'dir bsdad myi ga bar yod red/_sgang 'dir sdod shog_a tsi 'dir shog 'dir shog_lags/_e nas 'dir sdod/__,https://d38pmlk0v88drf.cloudfront.net/wav16k/STT_MV0400_0027_183887_to_192716.wav,STT_MV,2,175,8.829,wav16k/STT_MV0400_0027_183887_to_192716.wav,ཡ་ཡོང་ད་ཡ། ད་ངུ་རོ་ད། དེ་བསྡད་མྱི་ཡོད་མ་རེད་བྱས། ་་་་་་་ད་དེད་ཡོ་མ འ ་དི་སྡོད་ག ཡ། ཙི་ོག་འདིར་ཤོག ། ཨ་ནས་འདིར་སྡོད།
STT_MV0399_0140_848204_to_853840,སྤང་རྒྱན་མེ་ཏོག་སྙིང་རྗེ་མོ་ལ། སྤོ་ལགས་ཀི་སེམས་ནང་གི་བཞད།  ,spang rgyan me tog snying rje mo la/_spo lags ki sems nang gi bzhad/__,https://d38pmlk0v88drf.cloudfront.net/wav16k/STT_MV0399_0140_848204_to_853840.wav,STT_MV,2,59,5.636,wav16k/STT_MV0399_0140_848204_to_853840.wav,ྤང་རྒྱན་མེ་ཏོག་སྙིང་རྗེ་མོ་ལ། སྤོ་ལགས་ཀི་སེམས་ནང་གི་ཞད།
STT_MV0400_0065_431613_to_439332,ཡོང་ང་ཡོང་ང་། ངས་གཞུག་མ་ཞོར་ལ་ཡི་གེ་བསླབ་དགོས་ཨ། ཨུ་གོ། ལགས་སོ། ཐུགས་ཆེ་གནང་ལ། ཨེ་འདྲས་བྱེད་དགོས་མ་རེད། འོ་ཡག་བྱུང་ཡག་བྱུང་།  ,yong nga yong nga /_ngas gzhug ma zhor la yi ge bslab dgos a/_u go/_lags so/_thugs che gnang la/_e 'dras byed dgos ma red/_'o yag byung yag byung /__,https://d38pmlk0v88drf.cloudfront.net/wav16k/STT_MV0400_0065_431613_to_439332.wav,STT_MV,2,126,7.719,wav16k/STT_MV0400_0065_431613_to_439332.wav,ཡོང་ང་ཡོང་ང་། ངས་རྗེས་མ་ཞོར་ལ་ཡི་གེ་བསླབ་དགོས་ཨ། ཨེ་གོ། ལ་སེ། ཐུགས་ཆེ་གནང་ལ། ཨེ་འདྲས་བྱེད་དགོས་མ་རེད། འོ་ཡ་བྱུང་ཡ་བྱུང།
STT_MV0400_0066_442335_to_452039,འོ་དེ་གཙང་མ་ཡག་པོ་ཕྱིས་ཤོག་ཨ་མས། ལ། མ་གཞི་ད་བག་ཐུག་གཡུག་པའི་ཤུལ་རེད།  ,'o de gtsang ma yag po phyis shog a mas/_la/_ma gzhi da bag thug g.yug pa'i shul red/__,https://d38pmlk0v88drf.cloudfront.net/wav16k/STT_MV0400_0066_442335_to_452039.wav,STT_MV,2,70,9.704,wav16k/STT_MV0400_0066_442335_to_452039.wav,འོ་དི་གཙང་མ་ཡག་པོ་བྱིས་ཤོག་ཨ་མ། ལགས། མ་གཞི་ད་འབག་ཐུག་གཡུགས་པའི་ཤུལ་རེད། ད་འགྲིག་ཤོག།
STT_MV0400_0069_460549_to_469198,ལྷ་སར་གི་བག་ཐུག་དང་གྲོང་གསེབ་ཀི་བག་ཐུག་ཡང་ཆ་མ་རེད་ད། ཆ་མིན་སྦེ་ལ། ཧཧཧ། བུ་ཁྲིད། ལགས།  ,lha sar gi bag thug dang grong gseb ki bag thug yang cha ma red da/_cha min sbe la/_hahaha/_bu khrid/_lags/__,https://d38pmlk0v88drf.cloudfront.net/wav16k/STT_MV0400_0069_460549_to_469198.wav,STT_MV,2,86,8.649,wav16k/STT_MV0400_0069_460549_to_469198.wav,ལྷ་ས་བག་ཐུག་དང་ཡང་གྲོང་གསེབ་བག་ཐུག་ཆ་མ་རེད་ད། ཆ་མིན་པེ་ལགས། ཧ་ཧ་ཧ། བུ་ཁྲིད། ལགས།
STT_MV0400_0070_469198_to_471876,ད་རང་ད་རིང་ལྷ་སར་མར་ཡོང་བྱས།  ,da rang da ring lha sar mar yong byas/__,https://d38pmlk0v88drf.cloudfront.net/wav16k/STT_MV0400_0070_469198_to_471876.wav,STT_MV,2,30,2.678,wav16k/STT_MV0400_0070_469198_to_471876.wav,ད་རང་ད་རིང་ལྷ་སར་མར་ཡོང་བྱས།
STT_MV0400_0072_475436_to_485016,བདག་ཅིས་རྦད་དེ་ལྷ་སར་བསྡད་དགོས་བསམ་གིས་ལ། རེད་རེད། སོ་སོས་ཧུར་ཐག་བྱས་ན་བསྡད་ཐུབ་ཀི་རེད། ལགས། ཧུར་ཐག་འབད་ཐག་བྱེད་ཀི་ཡིན་ལ། ཧཧ།  ,bdag cis rbad de lha sar bsdad dgos bsam gis la/_red red/_so sos hur thag byas na bsdad thub ki red/_lags/_hur thag 'bad thag byed ki yin la/_haha/__,https://d38pmlk0v88drf.cloudfront.net/wav16k/STT_MV0400_0072_475436_to_485016.wav,STT_MV,2,127,9.58,wav16k/STT_MV0400_0072_475436_to_485016.wav,ཧ་ཧ། བདག་ཅིས་རྦད་དེ་ལྷ་སར་བསྡད་དགོས་བསམ་གི་ལགས།  རེད་རེད་རེད། སོ་སོས་ཧུར་ཐག་བྱས་ན་བསྡད་ཐུབ་ཀི་རེད། ལགས། ཧུར་ཐག་འབད་ཐག་བྱེད་ཀི་ལག།
STT_MV0400_0074_492315_to_498115,བདག་ཅིས་ཕུགས་ཀི་བསམ་འདུན་དེ་ཁྱེད་རང་ལ་ཞུས་དགོས། ཡིན་ནས་ཁྱེད་རང་གིས་མི་གཞན་པར་མ་གསུང་ཨ་ལ། ཨ་པོ།  ,bdag cis phugs ki bsam 'dun de khyed rang la zhus dgos/_yin nas khyed rang gis mi gzhan par ma gsung a la/_a po/__,https://d38pmlk0v88drf.cloudfront.net/wav16k/STT_MV0400_0074_492315_to_498115.wav,STT_MV,2,96,5.8,wav16k/STT_MV0400_0074_492315_to_498115.wav,བདག་ཅིའི་ཕུགས་ཀི་བསམ་དོན་དེ་ཁྱེད་རང་ལ་ཞུས་དགོས། ཡིན་ནས་ཁྱེད་རང་གིས་མི་གཞན་པར་མ་གསུང་ཨ་ལག། ཨ་ཕུ།
STT_MV0400_0075_498115_to_501439,ཨོ་ཙི། རང་གི་གསང་བ་བྱེད་སྟངས་དེར་བལྟས་ན།  ,o tsi/_rang gi gsang ba byed stangs der bltas na/__,https://d38pmlk0v88drf.cloudfront.net/wav16k/STT_MV0400_0075_498115_to_501439.wav,STT_MV,2,42,3.324,wav16k/STT_MV0400_0075_498115_to_501439.wav,ཨོ་ཙི། རང་གི་གསང་བ་བྱེད་སྟངས་དེར་བལྟས་ན།
STT_MV0400_0064_424382_to_431613,ཨ། ང་རྗེས་མ་གྲོང་ཁྱེར་ནང་ལ་ཡ་ལས་ཀ་ཞིག་བཙལ་དགོས་བསམ་གིས་ལ། ཧཧཧ། རང་གི་བསམ་བློ་གཏོང་སྟངས་དེ་ཡག་པོ་ཞེ་དྲག་འདུག ,a/_nga rjes ma grong khyer nang la ya las ka zhig btsal dgos bsam gis la/_hahaha/_rang gi bsam blo gtong stangs de yag po zhe drag 'dug_,https://d38pmlk0v88drf.cloudfront.net/wav16k/STT_MV0400_0064_424382_to_431613.wav,STT_MV,2,108,7.231,wav16k/STT_MV0400_0064_424382_to_431613.wav,ཨ། ང་རྗེས་མ་གྲོང་ཁྱེར་ནང་ལ་ཡ་ལས་ཀ་ཅིག་བཙལ་དགོས་བསམ་གི་ལ། ཧ་ཧཧ རང་བསམ་བློ་གཏོང་སྟངས་དེ་ཡག་པོ་ཞེ་དྲག་འདུག
STT_MV0400_0068_454845_to_460549,གྲོང་གསེབ་ལ་བག་ཐུག་གཡུག་མྱོང་ཡོད་པེ། གཡུག་མྱོང་ཡོད་ལ། ཧཧཧ། ད་ཡིན་ནས།  ,grong gseb la bag thug g.yug myong yod pe/_g.yug myong yod la/_hahaha/_da yin nas/__,https://d38pmlk0v88drf.cloudfront.net/wav16k/STT_MV0400_0068_454845_to_460549.wav,STT_MV,2,70,5.704,wav16k/STT_MV0400_0068_454845_to_460549.wav,གྲོང་གསེབ་ལ་ཡ་སབག་ཐུག་གཡུག་མྱོང་ཡོད་པེ། གཡུག་མྱོང་ཡོད་ལགས། ཧ་ཧ་ཧ། ད་ཡིན་ནས།
STT_MV0400_0048_299103_to_307963,ཨེ་ནས་ཨ་མར་ཡ་ཁ་ལག་བཟོ་རོགས་བྱོས། གཞན་ད་གེ་ཡོད་མ་རེད། ཡོང་བ་འདུག་གཱ ལ། ལས་ཀ་ཟེ་ཡོད་མ་རེད། ཁང་པ་ར་སྲུང་། ཨེ་ནས་ད་ག་རེད། རེད་རེད། བདག་ཅིས་ལས་ཀར་ཞེད་ཀི་མི་འདུག་ལ། གཙོ་བོ་དེ་ལས་ཀ།  ,e nas a mar ya kha lag bzo rogs byos/_gzhan da ge yod ma red/_yong ba 'dug gA_la/_las ka ze yod ma red/_khang pa ra srung /_e nas da ga red/_red red/_bdag cis las kar zhed ki mi 'dug la/_gtso bo de las ka/__,https://d38pmlk0v88drf.cloudfront.net/wav16k/STT_MV0400_0048_299103_to_307963.wav,STT_MV,2,176,8.86,wav16k/STT_MV0400_0048_299103_to_307963.wav,ཨེ་ནས་ཨ་མ་ཡ་ཁ་ལག་བཟོ་རོགས་བྱས། གཞན་དག་གེ་ཡོད་མ་རེད། ཡོང་འདུག་གལག། ཡ་ཟེ་ཡོད་མ་རེད། ཁང་པ་རང་སྒྲུངས། ན་ད་ག་རེད། རེད་རེད། བདག་ཆིས་ལ་ཡ་ཀ་ཞེད་ཀི་མི་འདུག་ལག། གཙོ་བོ་དེ།
STT_MV0400_0073_485016_to_492315,ཨ་མ་ཉིན་མ་ལགས། ད་དུང་བདག་ཅིས་ལ་ཡ་ཕུགས་ཀི་བསམ་འདུན་གཅིག་ཡོད་ལ། བསམ་འདུན་ག་རེ་ཡོད།  ,a ma nyin ma lags/_da dung bdag cis la ya phugs ki bsam 'dun gcig yod la/_bsam 'dun ga re yod/__,https://d38pmlk0v88drf.cloudfront.net/wav16k/STT_MV0400_0073_485016_to_492315.wav,STT_MV,2,82,7.299,wav16k/STT_MV0400_0073_485016_to_492315.wav,ཨ་ ཨ་མ་ཉི་མ་ལགས། ད་དུང་བདག་ཅིའ་ལ་ཡ་ཕུགས་ཀི་བསམ་དོན་གཅིག་ཡོད་ལ། བསམ་དོན་ག་རེ་ཡོད། ཧ་ཧ
STT_MV0400_0083_539294_to_549089,དེ་འདྲའི་སྐྱིད་པ་ལ་ཡ། དེ་འདྲའི་དགའ་བ་ལ་ཡ། དེ་རིང་ཁྱེད་རང་སྐྱིད་མདོག་ཁ་བོ་དེ་འདྲས་གང་སྦ། འདིར་ཤོག་ད། དེ་རིང་ང་བྱ་དགའ་ཞིག་རག་བྱུང་ང་།  ,de 'dra'i skyid pa la ya/_de 'dra'i dga' ba la ya/_de ring khyed rang skyid mdog kha bo de 'dras gang sba/_'dir shog da/_de ring nga bya dga' zhig rag byung nga /__,https://d38pmlk0v88drf.cloudfront.net/wav16k/STT_MV0400_0083_539294_to_549089.wav,STT_MV,2,133,9.795,wav16k/STT_MV0400_0083_539294_to_549089.wav,དེ་འདྲའི་སྐྱིད་པ་ལ་ཡ། དེ་འདྲའི་ྐང་བལ་ཡ། དེ་རིང་ཁྱེད་རང་སྐྱིད་མདོག་ཁ་པོ་དེ་འདྲས་གང་པ། འདིར་ཤོག་ད། དེ་རིང་ང་བྱ་དགའ་ཞིག་རག་བྱུང་ང་།
STT_MV0400_0046_290652_to_297290,བྱས་ཙང་བདག་ཅིས་ཡེ་ཡོང་འདོད་ཡོད་ལ། འོང་འོང། བུ་མོ་རང་གི་བསམ་བློ་གཏོང་སྟངས་དེ་འགྲིག་པ་རེད། ད་འདིར་ཡོང་ནས།  ,byas tsang bdag cis ye yong 'dod yod la/_'ong 'ong/_bu mo rang gi bsam blo gtong stangs de 'grig pa red/_da 'dir yong nas/__,https://d38pmlk0v88drf.cloudfront.net/wav16k/STT_MV0400_0046_290652_to_297290.wav,STT_MV,2,105,6.638,wav16k/STT_MV0400_0046_290652_to_297290.wav,བྱས་ཙང་། བདག་གིན་ཡ་ཡོང་འདོད་ཡོད་ལགས། འུ་འུ། བུ་མོ་རང་གི་བསམ་བློ་གཏང་སྟངས་དེ་འགྲིག་པ་རེད། ད་འདིར་ཡོང་ནས།
STT_MV0400_0071_471876_to_475436,རྗེས་མ་རྦད་དེ་ལྷ་སར་བསྡད་རྩིས་ཡོད་ཡང་ཡར་གྲོང་གསེབ་ལ་ལོག་རྩིས་ཡོད།  ,rjes ma rbad de lha sar bsdad rtsis yod yang yar grong gseb la log rtsis yod/__,https://d38pmlk0v88drf.cloudfront.net/wav16k/STT_MV0400_0071_471876_to_475436.wav,STT_MV,2,67,3.56,wav16k/STT_MV0400_0071_471876_to_475436.wav,རྗེས་མ་རྦད་དེ་ལྷ་སར་བསྡད་རྩིས་ཡོད། ཡང་ཡར་གྲོང་གསེབ་ལོག་རྩིས་ཡོད།
